{
  "bundle_id": "CASE-EXAMPLE_20260216T000000Z",
  "created_at": "2026-02-16T00:00:00Z",
  "case_id": "CASE-EXAMPLE",
  "custodian": "Example Custodian",
  "tool": {
    "name": "zeid-data-island-evidence-bundle-kit",
    "version": "0.1.0"
  },
  "source": {
    "base_url": "https://management.island.io/api/external/v1/",
    "collection_metadata": "collection_metadata.json",
    "notes": "Example only."
  },
  "files": [
    {
      "path": "data/island_users.jsonl",
      "sha256": "example",
      "bytes": 123,
      "content_type_guess": "application/json"
    }
  ]
}